問題No,難易度,問題,選択肢1,選択肢2,選択肢3,選択肢4,正解,コメント
C-52,C,"サークル代表者会議の代理人は、どのような人から選ばなければならないか？","学友会員であれば誰でもよい","同一サークルに所属する人","他のサークルの代表者","執行委員会の委員",2,"第21回総会議案「サークル代表者代理人の扱い」に「同一サークルに所属する人の中から代理人を立てることが出来る」とあります。"
C-53,C,"会計委員会の耐久消費財を破棄処分する際、誰の承認を得る必要があるか？","会計委員長","執行委員長","総会","不要",2,"第42回総会議案の6に「会計委員会のものに関しては執行委員長の承認を得ること」とあります。"
C-54,C,"サークル代表者会議に出席できない代表者が、代理人を立てられない場合にすべきことは何か？","会議を欠席する","後日議事録を確認する","事前に議長に連絡する","他の代表者に議決を委ねる",3,"サークルに関する細則 第12条4項に「代理人を立てられない場合は事前に議長に連絡しなければならない」とあります。"
C-55,C,"使途不明金の報告・話し合い等を行わなければならない期限はいつまでか？","発覚後1ヶ月以内","次の総会まで","当該年度の決算作成まで","特に定められていない",3,"第20回総会議案の本文5に「使途不明金の発生した年度の決算作成までには行うこと」とあります。"
C-56,C,"1991年度使途不明金処理で、2つあった郵便口座のうち、利息が雑収入に組み込まれたのはどちらの口座か？","1つ目の口座","2つ目の口座","両方の口座","どちらでもない",1,"第20回総会議案「1991年度使途不明金誓約書・返還金処理案」の本文に「1つ目の口座についた受け取り利息を今年度の雑収入として組み込むものとした」とあります。"
C-57,C,"第19回総会議案「サークル援助金決定方法に関する議案」は、いつ以降のサークル援助金に対して効力を発揮するか？","平成9年度","平成10年度","議案成立の年度","翌々年度",2,"第19回総会議案の本文9に「この議案は平成10年度以降のサークル援助金に対して効力を発揮する」とあります。"
C-58,C,"総会で可決された予算や決算報告は、誰が公示する義務を負うか？","執行委員長","会計委員長","総会議長","サークル代表者会議議長",2,"第17回総会議案の本文2に「会計委員長は…承認された本予算、および総会において承認された決算報告を公示する」とあります。"
C-59,C,"サークル代表者会議で投票を行う際、議長が全サークルに告知しなければならない情報に含まれないものはどれか？","投票により決定する議題","投票期日","投票方法","各サークルの投票予定",4,"第21回総会議案の6-2に告知すべき内容が列挙されていますが、「各サークルの投票予定」は含まれません。"
C-60,C,"第34回総会議案によると、保存版の議事録は会則で定められた期間を過ぎてもどうすべきか？","直ちに破棄する","可能な限り保存する","マイクロフィルム化する","デジタル化してクラウドに保存する",2,"第34回総会議案の本文に「会則で定められた期間をすぎても可能な限り保存する」とあります。"
C-61,C,"サークルが準公認を取り消されるケースとして、条文に挙げられていない理由はどれか？","活動目的に則した活動を行っていない","指定の提出物を提出していない","部員同士の仲が悪い","本会が公認するのにふさわしくない",3,"サークルに関する細則 第5条に取消理由が列挙されていますが、「部員同士の仲が悪い」は含まれていません。"
C-62,C,"耐久消費財の修理・購入で会計委員長と連絡が取れない場合に執行委員長の承認で支出した後、いつまでに会計委員長へ報告が必要か？","直ちに","購入後一週間以内に","次の総会までに","報告は不要",2,"第42回総会議案の4に「会計委員長への報告を購入後一週間以内に行うこと」とあります。"
C-63,C,"執行委員長が、総会の終了時刻をあらかじめ設定する議長の権利を侵害した場合、どうなるか？","議長は執行委員長を解任できる","総会は無効となる","議長は異議を唱えることができる","会則に明確な規定はない",4,"議長の権利（総会に関する細則第6条）を執行委員長が侵害した場合の罰則規定は、提供された文書には見当たりません。これは規則の不備とも言えます。"
C-64,C,"有効となる個人委任状に記載が必要で、議長委任状には不要な項目は何か？","総会開催年月日","委任者の所属及び氏名","被委任者の所属及び氏名","委任した年月日",3,"総会に関する細則 第9条で、iv「被委任者の所属及び氏名」は「個人委任状の場合」と限定されています。"
C-65,C,"基本則第14条で、執行委員長が欠員となった場合の対応として定められていないものはどれか？","副執行委員長が職務を代行する","すみやかに臨時総会を開催する","新たな正副執行委員長を任命する","会計委員長が臨時代行する",4,"基本則 第14条に記載されている選択肢は、副執行委員長の代行か、臨時総会での新委員長任命です。「会計委員長が臨時代行する」は含まれていません。"
C-66,C,"サークル代表者会議議長団の罷免要求が受理された場合、議長団員はどうなるか？","警告を受ける","任期が半年短縮される","罷免される","サークル代表者の資格を失う",3,"サークルに関する細則 第9条5項に「議長団員は罷免される」とあります。"
C-67,C,"第23回総会の決定で、第1回から第7回総会までの可決議案のうち、「その他の議案」はどうなったか？","全て有効とされた","全て失効とされた","個別に審議されることになった","記録が破棄された",2,"第23回総会議案の本文3に「その他の議案については全て失効とする」とあります。"
C-68,C,"サークル代表者会議において、議長が本会各機関の役員に対して出席を要請できるのはどのような場合か？","議長が必要であると判断した場合","サークル代表者の過半数が要求した場合","執行委員会が指示した場合","常に要請できる",1,"サークルに関する細則 第13条に「議長が必要であると判断した場合」と記載されています。"
C-69,C,"第47回総会で決まった、公認サークルの準公認格下げに関する条文が効力を発揮するのはいつからか？","議案可決と同時","平成24年4月1日","翌年度の総会から","執行委員会が定めた日",2,"第47回総会議案の本文に「本議案は、平成24年4月1日より効力を発揮する」とあります。"
C-70,C,"第19回総会議案で、サークル援助金の額を最終的に決定する機関はどこか？","会計委員会","執行委員会","サークル代表者会議","総会",3,"第19回総会議案の本文8に「サークル代表者会議で各サークルに対する援助金額を決定する」とあります。"
C-71,C,"本会の会計事務に必要なことを行う専権を持つ機関は何か？","執行委員会","会計委員会","総会","サークル代表者会議",2,"基本則 第17条に会計委員会の職務として「その他、本会の会計事務に必要なことを行う」とあり、これが会計監査と共に専権事項とされています。"
C-72,C,"総会議長は、副議長及び書記をどこから指名するか？","執行委員会の中から","サークル代表者の中から","会場内にいる総会出席会員の中から","公募する",3,"総会に関する細則 第6条に「会場内にいる総会出席会員の中から副議長及び書記を指名し」とあります。"
C-73,C,"耐久消費財のリストの変更項目は、どこに記載して報告されるか？","学友会誌「群青」","決算報告書類上","執行委員会の掲示板","学友会ウェブサイト",2,"第42回総会議案の8に「決算報告書類上に併せて各機関のリストの変更した項目を記載し、報告する」とあります。"
C-74,C,"学友会員が休学申請を行う際に提示する「休学願の控え」に必要なものは何か？","本人の署名","指導教員の署名","会計委員長の署名","教務課の受領印",4,"学友会員の権利における細則 第2条に「教務課の受領印が押されたものに限る」とあります。"
C-75,C,"サークル代表者でない者がサークル代表者会議に参加し意見を述べるには、誰の許可が必要か？","執行委員長","会計委員長","議長","出席代表者の過半数",3,"サークルに関する細則 第13条に「議長が認めた場合、その会議に参加し意見を述べることができる」とあります。"
C-76,C,"予備費の支出は、誰が承認し、誰が支出するか？","執行委員長が承認し、会計委員長が支出する","会計委員長が承認し、執行委員長が支出する","総会が承認し、執行委員長が支出する","執行委員長が承認し、自身で支出する",2,"基本則 第22条に「予備費は会計委員長が承認し執行委員長が支出する」と明記されています。"
C-77,C,"第17回総会議案で、失効が明記された「学友会決算報告の承認に関する決議」は、第何回総会で可決されたものか？","第5回総会","第7回総会","第9回総会","第12回総会",2,"第17回総会議案の補足に「第7回総会において可決した…」と明記されています。"
C-78,C,"総会で審議される決算に計上される「次年度繰越額」の計算式として正しいものはどれか？","総収入額 － 総支出額","前年度繰越額 ＋ 総収入額 － 総支出額","総収入額 ＋ 総支出額","前年度繰越額 － 総支出額",2,"第17回総会議案の7.4に「本会の次年度繰越額とは、本会の前年度繰越額に総収入額を加え、本会の総支出額を差し引いた額である」とあります。"
C-79,C,"サークル代表者会議で援助金が決定できない場合、その援助金はどうなるか？","支給されず、国庫に返納される","支給されず、次年度へ繰り越される","議長の判断で分配される","執行委員会が分配する",2,"サークルに関する細則 第18条に「その援助金は原則として次年度へ繰り越される」とあります。"
B-1,B,"基本則を改正または廃止するために必要な総会での賛成数はどれか？","会員の十分の一を超える賛成数","会員の六分の一を超える賛成数","会員の五分の一を超える賛成数","出席会員の過半数の賛成数",3,"基本則 第5条に定められています。細則改正の「六分の一」（第6条）と混同しないかがポイントです。"
B-2,B,"総会の決議における票の扱いについて、正しい記述はどれか？","個人委任状は場内票に含まれ、議長委任状も場内票に含まれる。","規定数を超えた個人委任状は、全て議長委任状として扱われる。","個人委任状は場内票に含まれるが、議長委任状は場内票に含まれない。","議長団の票は、個人委任状として扱われる。",3,"総会に関する細則 第11条4項と第12条3項を組み合わせる必要があります。"
B-3,B,"サークルが「公認」されるための構成員の要件として、正しいものはどれか？","学友会員が5人以上在籍していること。","学友会員が5人以上在籍し、さらに本学一年生が在籍していること。","構成員に本学一年生が5人以上在籍していること。","構成員全員が学友会員であること。",2,"サークルに関する細則 第2条の「準公認」と「公認」の要件の違いを正確に理解しているかを問う問題です。"
B-4,B,"予算に含まれる「内部留保予算」の取り崩しについて、正しい記述はどれか？","執行委員長の判断で自由に取り崩せる。","会計委員長の承認があれば取り崩せる。","予備費を除き、総会の決議を必要とする。","いかなる場合も取り崩すことはできない。",3,"第17回総会議案の6.4に「予備費を除いて総会の決議を必要とする」とあり、例外規定まで含めて理解しているかが問われます。"
B-5,B,"使途不明金が発生した機関が会計委員会である場合、改善方法の話し合いは誰と行わなければならないか？","その機関内で話し合えばよい","総会議長","執行委員長","サークル代表者会議議長",3,"第20回総会議案の本文3に「会計委員会の場合は、会計委員長のかわりに執行委員長がこれを行う」という例外規定があり、これを読み取れるかがポイントです。"
B-6,B,"会計委員会の耐久消費財を修理・購入する場合、誰の承認が必ず必要か？","執行委員長","会計委員長","副執行委員長","承認は不要",1,"第42回総会議案の4に「会計委員会の耐久消費財は執行委員長の承認を必ず得ること」と明確に記載されています。他の機関の原則（会計委員長の承認）とは異なる例外規定を問う問題です。"
B-7,B,"サークル代表者会議における投票で議決を行う場合、有効となるための条件はどれか？","全サークル代表者の過半数が投票すること。","有効投票数がサークル代表者数の三分の二以上であること。","投票率に関わらず、投票したサークルの過半数で決すること。","有効投票数が定足数に達していること。",2,"第21回総会議案「サークル代表者会議における投票」に「有効投票数がサークル代表者数の三分の二以上でなければ無効とする」とあります。「過半数で決する」というルールと混同しないかがポイントです。"
B-8,B,"第17回総会の議案によって失効したと明記されていない議案はどれか？","第7回総会「学友会決算報告の承認に関する決議」","第16回総会「本会の予算及び決算の原則に関する決議」","第9回総会「サークル援助金配布方法に関する議案」","第16回と第7回の両方",3,"第17回総会議案の補足に失効する議案が明記されています。「サークル援助金配布方法に関する議案」は第19回総会の議案で失効します。"
B-9,B,"総会で正副執行委員長が任命されなかった場合、どうなるか？","会計委員長が臨時に職務を代行する。","その総会を開いた正副執行委員長が引き続き職務を行う。","直ちに再度公募を行い、臨時総会を開く。","学友会は一時的に活動を停止する。",2,"基本則 第3章 第12条7項に定められています。"
B-10,B,"学友会公認サークルが、構成員4人で全員が学友会員の場合、準公認に格下げされるか？","格下げされる。","格下げされない。","総会の判断による。","一年間の猶予が与えられる。",2,"サークルに関する細則 第5条の2のただし書き「サークル構成員が5人未満のサークルの場合、その構成員全員が学友会員だった場合に限り、これに当てはまらない」という例外規定を理解しているかが問われます。"
B-11,B,"予備費を支出できるのはどのような場合か？","予算が不足したあらゆる場合","不測の事態によって本会の運営上支出の必要が急務である場合","各機関の備品購入のため","イベントの赤字補填のため",2,"第17回総会議案の6.5に予備費の目的が定義されています。他の選択肢も可能性はありますが、最も正確な定義を問うています。"
B-12,B,"新入生歓迎期間中の宣伝広報活動の管理は、どの機関が一任されるか？","執行委員会","新入生歓迎実行委員会","サークル代表者会議","大学当局",2,"宣伝広報活動に関する細則 第2条の例外規定を読み取れるかがポイントです。原則は執行委員会ですが、期間中は管理が移ります。"
B-13,B,"議長団宛に提出された個人委任状は、どのように扱われるか？","無効となる。","議長委任状として扱われる。","提出者に返却される。","そのまま個人委任状として議長が票を預かる。",2,"総会に関する細則 第11条3項に明記されています。委任状の種類の変化を問う問題です。"
B-14,B,"耐久消費財を紛失した機関が、総会で報告を怠った場合、どのようなペナルティがあるか？","罰金が科せられる。","機関の長が罷免される。","次回総会以降、1年間代替品を購入できない。","当該機関の予算が削減される。",3,"第42回総会議案の7-4に記載されている具体的なペナルティ内容を正確に把握しているか問います。"
B-15,B,"過去の決算報告に問題が見つかった場合、責任追及はいつまで可能か？","本年度決算が承認されたら、それ以降は一切追及できない。","本年度決算可決より以前に明らかになった問題に対しては、継続して追及できる。","時効はなく、いつでも追及できる。","問題が明らかになってから1年以内なら追及できる。",2,"第17回総会議案の本文4のただし書きを理解しているか問われます。原則と例外の関係を把握する問題です。"
B-16,B,"1991年度使途不明金に関して、会計委員長からの返還金20,000円はどう処理されたか？","会計委員長に返還された。","雑収入に組み込まれた。","そのまま学友会費にとどめられた。","郵便口座に保管されたままになった。",3,"第20回総会の「1991年度使途不明金誓約書・返還金処理案」という非常に個別具体的な議案の内容を問う問題です。"
B-17,B,"サークル代表者会議の議長が権限を行使する前に、対象となるサークルに対して行わなければならないことは何か？","総会で承認を得ること。","執行委員長に報告すること。","「その権限を使用する旨」を確実な方法で連絡すること。","特に何もしなくてよい。",3,"第21回総会議案の6-4に記載されている、議長の権限行使の前提条件を問う問題です。"
B-18,B,"総会の議事録が作成されるまでの間、議事録を補うものとして認められていないのはどれか？","録音媒体","総会書記による記録","議長の個人的なメモ","録音媒体と書記記録の両方",3,"第34回総会議案の本文5に「録音媒体と総会書記による記録は、議事録が作成されるまでの間これを補う」とあります。「議長のメモ」は含まれません。"
B-19,B,"予備費から耐久消費財の費用を執行する際、金額の参考とされるものは何か？","見積書","購入時のレシート","正式な領収書","担当者の申告額",3,"第42回総会議案の9に「正式な領収書のみを参考とする」と明記されています。"
B-20,B,"サークルの正式名称について、どのようなものが望ましいとされているか？","アルファベットのみの名称","「～委員会」のような名称","活動目的に則した名称","ユーモアのある名称",3,"サークルに関する細則 第2条に「活動目的に則することが望ましい」とあります。「～委員会」は避けるべきとされています。"
B-21,B,"準公認サークルの有効期間を過ぎた場合、そのサークルはどうなるか？","自動的に公認サークルに昇格する。","総会で議決されるまで準公認期間が延長される。","総会で議決されることなく準公認を取り消される。","執行委員会が存続を判断する。",3,"サークルに関する細則 第5条のただし書きに明記されています。"
B-22,B,"第42回総会議案「耐久消費財に関する議案」の成立により、失効した議案はどれか？","第16回総会「本会の会計管理に対する原則」案","第20回総会「高額耐久消費財に関する議案」","第21回総会「サークル代表者会議に関する補則」","第23回総会「総会の議事録の保存方法及び公表に関する議案」",2,"第42回総会議案の末尾に失効する議案が明記されています。過去の議案との関連性を問う問題です。"
B-23,B,"総会において、サークルの承認・取り消しに関する議案は、どの程度の優先順位で審議されるか？","最も優先される。","学友会全体、予算・決算に関する議案の次に審議される。","最も後回しにされる。","優先順位は特に定められていない。",2,"総会に関する細則 第19条に定められた3つの優先順位を正確に記憶しているか問います。"
B-24,B,"ある学友会員が、他の会員3人から個人委任状を預かってきた。この委任状の扱いはどうなるか？","3人分すべて有効となる。","3人分すべて無効となる。","規定数（2人分）を超えているため、委任者の確認が取れない限り破棄される。","最初の2人分だけ有効となる。",3,"総会に関する細則 第11条2項の規定を具体的な事例に当てはめて考える問題です。"
B-25,B,"休学による権利延長の制度について、対象となる休学の種類として正しいものはどれか？","病気や経済的理由による休学のみ","留学に伴う休学のみ","ボランティア活動のための休学は対象外","留学に伴う休学を含む、全ての休学",4,"学友会員の権利における細則 第1条に「休学（留学に伴う休学を含む）」とあり、特に除外規定はないため、全ての休学が対象と解釈できます。"
B-26,B,"耐久消費財のリスト更新は、どのくらいの頻度で行われるか？","半年に一回","各年度一回","二年に一回","必要に応じて随時",2,"第42回総会議案の8に「各年度一回、各機関の耐久消費財のリストの更新を行う」とあります。"
B-27,B,"前年度から繰り越した資金の総額を指す会計用語は何か？","総収入額","前年度仮決算報告","前年度繰越額","内部留保予算",3,"第17回総会議案の5.1に定義されています。他の紛らわしい用語と区別できるかがポイントです。"
B-28,B,"サークル代表者会議で、やむを得ず代表者が出席できない場合に立てる代理人についての記述で正しいものはどれか？","代理人はどのサークルのメンバーでもよい。","代理人は複数のサークルの代理人を兼任できる。","代理人はサークル代表者と同等に扱われる。","代理人を立てるのに議長の許可が必要である。",3,"サークルに関する細則第12条に「その際代理人はサークル代表者と同等に扱われる」とあります。"
B-29,B,"総会で可決された予算修正案がある場合、「本予算」にあたるものはどれか？","修正前の予算","修正後の予算","修正前後の予算両方","どちらも本予算ではない",2,"第17回総会議案の7.1に「総会において予算修正が行われた場合、修正後の予算が本予算にあたる」と明記されています。"
B-30,B,"使途不明金の報告及び改善に関する話し合いを怠った機関に対し、責任追及や補填を求めることができるのは誰か？","総会議長","会計委員長または、執行委員長","サークル代表者会議議長","全学友会員の投票",2,"第20回総会議案の本文4に記載されています。"
B-31,B,"公聴会に出席した会員でない者は、どのような条件下で意見を述べることができるか？","どのような条件下でも意見は述べられない。","執行委員長が認めた場合。","会場の会員の過半数が認めた場合。","公聴会のテーマに直接関係がある場合。",2,"公聴会に関する細則第2条に明記されています。"
B-32,B,"総会で審議される本会の決算に、計上する必要がないとされている項目はどれか？","本予算","前年度繰越額","内部留保予算","支出決算",3,"第17回総会議案の7に決算に計上する内容が列挙されています。「内部留保予算」は予算の項目であり、決算には含まれません。"
