問題No,難易度,問題,選択肢1,選択肢2,選択肢3,選択肢4,正解,コメント
D-1,D,"この会の正式名称は何か？","電気通信大学学生会","電気通信大学学友会","電気通信大学自治会","電気通信大学生徒会",2,"基本則 第1章 第1条に「本会は電気通信大学学友会と称し」と記載されています。"
D-2,D,"学友会に1年次で加入する場合の会費はいくらか？","10,000円","15,000円","20,000円","5,000円",3,"学友会費に関する細則 第1条に「1年次加入 ・・・・・・20,000円」と記載されています。"
D-3,D,"学友会の最高責任者は誰か？","会計委員長","総会議長","執行委員長","サークル代表者会議議長",3,"基本則 第3章 第11条に「執行委員長は本会の最高責任者である」と記載されています。"
D-4,D,"学友会の最高の決議機関は何か？","執行委員会","会計委員会","サークル代表者会議","総会",4,"基本則 第2章 第7条に「総会は本会の最高の決議機関である」と記載されています。"
D-5,D,"学友会の目的として正しいものはどれか？","会員の就職活動の支援","会員の学業成績の向上","会員の大学生活の充実","大学運営への参画",3,"基本則 第1章 第2条に「本会は、本会会員の大学生活の充実を目的として運営されなければならない」と記載されています。"
D-6,D,"4年次で学友会に加入する場合の会費はいくらか？","20,000円","15,000円","10,000円","5,000円",4,"学友会費に関する細則 第1条に「4年次加入 ・・・・・・ 5,000円」と記載されています。"
D-7,D,"学友会誌の編集及び発行を行う機関はどれか？","執行委員会","群青編集委員会","新入生歓迎実行委員会","ネットワーク管理委員会",2,"機関における細則 第2条に「群青編集委員会 学友会誌の編集及び発行を行う」と記載されています。"
D-8,D,"調布祭の企画運営を行う機関はどれか？","執行委員会","群青編集委員会","調布祭実行委員会","新入生歓迎実行委員会",3,"機関における細則 第2条に「調布祭実行委員会 調布祭の企画運営を行う」と記載されています。"
D-9,D,"本会の収入源として、会則に定められていないものはどれか？","会費","寄付金","大学からの補助金","雑収益金",3,"基本則 第6章 第19条には「会費」「寄付金」「雑収益金」が定められていますが、「大学からの補助金」という直接の記載はありません。"
D-10,D,"学友会員であるための基本的な条件は何か？","本学の大学院生であること","本学の教職員であること","本学の学士課程の学生であること","本学の卒業生であること",3,"基本則 第1章 第3条に「本会の会員であるには本学の学士課程の学生であることを必要とする」と記載されています。"
D-11,D,"新入生歓迎行事の企画運営を行う機関はどれか？","調布祭実行委員会","新入生歓迎実行委員会","執行委員会","会計委員会",2,"機関における細則 第2条に「新入生歓迎実行委員会 新入生歓迎行事の企画運営を行う」と記載されています。"
D-12,D,"副執行委員長の定員は何名か？","1名","2名","3名","特に定められていない",2,"基本則 第3章 第11条に「なお、定員を２名とする」と記載されています。"
D-13,D,"学友会の年度のうち、前期の期間はいつからいつまでか？","四月一日より九月三十日まで","四月一日より三月三十一日まで","六月一日より十一月三十日まで","十二月一日より五月三十一日まで",3,"基本則 第7章 第23条に「前期六月一日より十一月三十日まで」と記載されています。"
D-14,D,"学友会の年度のうち、後期の期間はいつからいつまでか？","十月一日より三月三十一日まで","十一月三十日より五月三十一日まで","六月一日より十一月三十日まで","十二月一日より五月三十一日まで",4,"基本則 第7章 第23条に「後期十二月一日より五月三十一日まで」と記載されています。"
D-15,D,"総会の場で議案の提出及び修正を行うには、どのような形式で提出しなければならないか？","口頭での申し出","書面による提出","電子メールによる提出","事前の電話連絡",2,"第12回総会議案「総会における議案提出及び修正方法に関する議案」の本文に「書面による提出を行なわなければならない」とあります。"
D-16,D,"2年次で学友会に加入する場合の会費はいくらか？","20,000円","15,000円","10,000円","5,000円",2,"学友会費に関する細則 第1条に「2年次加入 ・・・・・・15,000円」と記載されています。"
D-17,D,"3年次で学友会に加入する場合の会費はいくらか？","20,000円","15,000円","10,000円","5,000円",3,"学友会費に関する細則 第1条に「3年次加入 ・・・・・・10,000円」と記載されています。"
D-18,D,"公聴会において、議決を行うことはできるか？","執行委員長の許可があればできる","出席者の過半数の賛成があればできる","いかなる方法の議決も行ってはならない","重要な議題に限ってできる",3,"公聴会に関する細則 第4条に「公聴会においてはいかなる方法の議決も行ってはならない」とあります。"
D-19,D,"本会全体のネットワーク全般の管理を行う機関はどれか？","執行委員会","会計委員会","ネットワーク管理委員会","調布祭実行委員会",3,"機関における細則 第2条に「ネットワーク管理委員会 本会全体のネットワーク全般の管理を行う」と記載されています。"
D-20,D,"総会の議事録は、何年間保管されなければならないか？","1年間","3年間","6年間","永久に",3,"総会に関する細則 第22条に「総会の議事録は、６年間保管されなければならない」と記載されています。"
D-21,D,"サークルが公認を受ける前に、まず何になる必要があるか？","同好会","準公認サークル","仮設サークル","任意団体",2,"サークルに関する細則 第1条に「公認サークルとして承認される前には、準公認サークルであることを必要とする」と記載されています。"
D-22,D,"総会の種類として、会則に定められていないものはどれか？","定期総会","臨時総会","緊急総会","定期総会と臨時総会の両方",3,"基本則 第2章 第9条には「定期総会」と「臨時総会」の二種類が定められています。"
D-23,D,"サークル代表者会議の議決は、どのように行われるか？","議長の独断","出席者の満場一致","1サークル1票の多数決","援助金の額に応じた投票",3,"サークルに関する細則 第11条に「サークル代表者会議における議決は、１サークル1票の多数決で行い」とあります。"
D-24,D,"総会に関する細則で定義されている「議長団」に含まれない役職はどれか？","議長","副議長","書記","執行委員長",4,"総会に関する細則 第4条に「議長団は、議長、副議長及び書記により構成される」とあります。"
D-25,D,"会計委員会の専権（その機関だけが行える職務）とされる職務は何か？","予算の作成","予算の執行","予算についての監査と決算の総会報告","予備費の支出承認",3,"基本則 第5章 第17条に「会計委員会は本会の予算についての監査を行い、決算を総会に報告をする。なお、この職務は会計委員会の専権とする」とあります。"
D-26,D,"一旦納入された学友会費は、原則として返却されるか？","いつでも返却される","入学辞退者を除き原則として返却しない","理由があれば返却される","半額が返却される",2,"学友会費に関する細則 第1条に「一旦納入された会費は、入学辞退者を除き原則として返却しない」とあります。"
D-27,D,"サークルが公認・準公認される際に、活動目的として禁止されているものは何か？","スポーツ活動","文化活動","特定の政治活動または宗教活動","学術研究活動",3,"サークルに関する細則 第2条に「特定の政治活動または宗教活動を行うことを目的としないこと」とあります。"
D-28,D,"執行委員長が総会を公示する際、公示内容に含まれないものはどれか？","開催日時","開催場所","審議される議案の一覧","開催日時と開催場所の両方",3,"総会に関する細則 第3条で公示すると定められているのは「開催日時」と「開催場所」です。議案の一覧は定められていません。"
D-29,D,"緊急の際に備えて計上することができる費用を何というか？","特別費","予備費","交際費","雑費",2,"基本則 第6章 第22条に「本会は緊急の際に備えて、予備費を計上することができる」とあります。"
D-30,D,"過年次生が追加で1年間会員の権利を得るための会費はいくらか？","20,000円","10,000円","5,000円","1,000円",3,"学友会費に関する細則 第1条に「過年次生追加加入 ‥‥‥ 5,000円」とあります。"
D-31,D,"委任状の種類として定められているものは「個人委任状」と何か？","団体委任状","サークル委任状","議長委任状","執行部委任状",3,"総会に関する細則 第10条に「個人委任状」「議長委任状」の2種類が定められています。"
D-32,D,"サークル援助金の対象とならないのはどちらか？","公認サークル","準公認サークル","どちらも対象となる","どちらも対象とならない",2,"サークルに関する細則 第19条に「準公認期間中の活動に対して、サークル援助金は支給されない」とあります。"
D-33,D,"第55回総会で解体された機関はどれか？","体育会","音楽協議会","群青編集委員会","ネットワーク管理委員会",2,"第55回総会議案「音楽協議会の解体およびその解体に関する会則改正案」に記載があります。"
D-34,D,"第19回総会の議案で定められた「サークル援助金」の決定プロセスで、サークルが年度始めに会計委員会に提出する必要がない資料はどれか？","援助金希望項目に関する領収書","次年度の活動計画書","前年度部員名簿","前年度活動報告",2,"第19回総会議案の本文3に提出資料が列挙されており、「次年度の活動計画書」は含まれていません。"
D-35,D,"総会の場で提出する議案の書面に、必ず記載しなければならない項目はどれか？","提出者の連絡先","議案名","想定される反対意見","参考資料一覧",2,"第12回総会議案に記載すべき事項として「議案名」「提出者」「本文」「主旨」「提出理由」が挙げられています。"
D-36,D,"サークル代表者会議の議長団に選出されないのはどのサークルの代表者か？","文化系サークル","体育会系サークル","公認サークル","準公認サークル",4,"サークルに関する細則 第9条に「準公認サークルの代表者は議長団に選出されない」とあります。"
D-37,D,"第21回総会の議案によると、サークル代表者は複数のサークルの代表者を兼任できるか？","できる","できない","議長の許可があればできる","2つまでならできる",2,"第21回総会議案「サークル代表者の扱い」に「サークル代表者は複数のサークルの代表者を兼任できない」とあります。"
D-38,D,"学友会員が休学する際に権利の延長を申請する場合、受付を行うのはどの機関か？","執行委員会","会計委員会","総会議長","所属サークルの代表者",2,"学友会員の権利における細則 第2条に「受付は、会計委員会が行うこととする」とあります。"
D-39,D,"耐久消費財のリストに購入年度が不明なものを記載する際、どのように表記するか？","不明","記載しない","H00","X00",4,"第42回総会議案「耐久消費財に関する議案」の3-1に「不明ならＸ００とする」と記載されています。"
D-40,D,"使途不明金が発生した機関が、まず報告しなければならない相手は誰か？","総会議長","執行委員長","会計委員長","全学友会員",3,"第20回総会議案「使途不明金の処理方法に関する議案」の本文2に「会計委員長に報告しなければならない」とあります。"
D-41,D,"基本則は本会のどのような規範であると定められているか？","努力目標","行動指針","最高規範","参考資料",3,"基本則 第1章 第4条に「基本則は本会の最高規範である」とあります。"
D-42,D,"総会の審議の順序を定めるのは誰か？","総会議長","執行委員会","会計委員長","出席した会員の多数決",2,"総会に関する細則 第19条に「総会の審議の順序は、執行委員会がこれを定める」とあります。"
D-43,D,"サークル代表者会議に出席できない場合、代理人を立てることはできるか？","できない","できる","議長の許可があればできる","執行委員会の許可があればできる",2,"サークルに関する細則 第12条に「やむをえない理由で代表者が出席できない場合は代理人を立て出席させることができる」とあります。"
D-44,D,"予算に含まれる「総収入額」は何と何を足した額に一致しなければならないか？","総支出額と前年度繰越額","総支出額と総内部留保額","総支出額と寄付金額","会費収入とその他の収入",2,"第17回総会議案の6.6に「本会の総収入額は総支出額と総内部留保額を足した額に一致しなければならない」とあります。"
D-45,D,"会計担当者は、どのくらいの頻度で資金と帳簿が一致することを確認しなければならないか？","一年に一度","半年に一度","三ヶ月に一度","一月に一度",4,"第16回総会議案「本会の会計管理に対する原則」の本文に「一月に一度、自らの管理する資金が帳簿の記載と一致する事を確認する」とあります。"
D-46,D,"会計委員会は定期的に本会の全ての資金の運営状況を確認するが、これは会計年度中に少なくとも何回行わなければならないか？","1回","2回","3回","4回",3,"第16回総会議案「本会の会計管理に対する原則」の本文に「これらは会計年度中に少なくとも3回おこなう」とあります。"
D-47,D,"総会の議事録を作成する際、元にするものは何か？","書記の記憶","出席者の証言","録音したもの","議長のメモ",3,"第34回総会議案「総会の議事録の保管方法及び公表に関する議案」の本文に「執行委員会は録音したものを元に議事録を冊子として作成する」とあります。"
D-48,D,"「本予算」とは何か？","会計委員長が最初に作成した予算","総会で審議される前の予算","総会において最終的に可決された予算","前年度の予算",3,"第17回総会議案の7.1に「本予算とは、総会において最終的に可決された予算の事である」と定義されています。"
D-49,D,"総会で決議を行うのは、どのような場合か？","議案提出者が要求した場合","議案に対する審議が十分に行われたと議長が判断した場合","執行委員長が指示した場合","会場の雰囲気が盛り上がった場合",2,"総会に関する細則 第20条に決議を行う場合の一つとして記載されています。"
D-50,D,"サークル代表者会議の議長は投票権を持つか？","常に1票を持つ","常に2票を持つ","投票権を持たない","棄権者が出た場合のみ持つ",3,"サークルに関する細則 第11条に「議長は投票権を持たない」と記載されています。"
D-51,D,"学友会の本部はどこに置くと定められているか？","東京都調布市","電気通信大学内","執行委員長の自宅","オンライン上",2,"基本則 第1章 第1条に「電気通信大学内にその本部を置く」と記載されています。"
D-52,D,"公聴会の目的は何ですか？","予算案を議決すること","会員が意見を交換すること","新入生を歓迎すること","サークルの承認を行うこと",2,"公聴会に関する細則 第1条に「会員が意見を交換する事を目的とする」と記載されています。"
D-53,D,"執行委員会の職務として正しいものはどれか？","学友会誌の編集","調布祭の企画運営","本会全体に関係する事務","本会の会計監査",3,"機関における細則 第2条に「本会全体に関係する事務を行う」と記載されています。"
D-54,D,"サークル代表者会議の議長団の合計人数は何名か（補助の執行委員を除く）？","2名","3名","4名","5名",3,"サークルに関する細則 第9条に「議長、副議長、書記２名の計4 名によって構成され」と記載されています。"
D-55,D,"学友会員の権利として、会則に定められていないものはどれか？","議案提出権","被選挙権","審議権","学食の割引",4,"基本則 第3条の3に権利が列挙されていますが、「学食の割引」は含まれていません。"
D-56,D,"会計年度中の本会の全ての収入の総額を何と呼ぶか？","総支出額","総収入額","前年度繰越額","内部留保予算",2,"第17回総会議案の5.2に「本会の総収入額とは、会計年度中の本会の会費収入、全ての機関の収入、寄付金及びその他全ての収入の総額である」と定義されています。"
D-57,D,"サークル代表者会議を構成するのは誰か？","学友会の全機関の長","学友会公認および準公認サークルの代表者","執行委員会の委員","総会で選ばれた会員",2,"サークルに関する細則 第7条に「学友会公認および準公認サークルの代表者により構成される」と記載されています。"
D-58,D,"議案の提出を望む者は、どこに提出するか？","総会議長","会計委員会","執行委員会","サークル代表者会議",3,"総会に関する細則 第18条に「執行委員会に提出することができる」と記載されています。"
D-59,D,"耐久消費財のリスト記入例に記載されているプリンタの型番は何ですか？","LP-S7160","PIXUS TS8430","offirio LP-V1000","MFC-J6983CDW",3,"第42回総会議案の記入例に「プリンタ（offirio LP-V1000）」と記載されています。"
D-60,D,"第58回総会議案の施行年月日はいつか？","平成29年12月1日","平成30年6月1日","平成27年4月1日","平成19年5月24日",2,"第58回総会議案の補足に「本議案は平成30年6月1日より効力を発揮する」と記載されています。"
D-61,D,"学友会の決算はどこで報告されなければならないか？","執行委員会","会計委員会","サークル代表者会議","総会",4,"基本則 第21条に「本会の決算は、総会で報告されなければならない」と記載されています。"
D-62,D,"第29回総会で、第30回総会での経過報告が要請された細則は何に関するものか？","サークルに関する細則","会計に関する細則","宣伝広報活動に関する細則","総会に関する細則",3,"第29回総会議案「細則改正に対する報告の要請」に記載されています。"
D-63,D,"サークルの公認期間は原則としてどうなっているか？","1年間","2年間","5年間","半永久的",4,"サークルに関する細則 第4条に「公認期間は原則として半永久的である」と記載されています。"
D-64,D,"総会において録音されたものは、何のために使用されるか？","ラジオ番組の制作","議事録の作成","会員への配布","BGM",2,"第34回総会議案の本文に「録音したものを元に議事録を冊子として作成する」とあります。"
D-65,D,"資金とは、現金、銀行口座の他に何を含むか？","不動産","株式","その他一切の運営資金","仮想通貨",3,"第16回総会議案の本文に「その他一切の運営資金を指す」とあります。"
D-66,D,"会計年度の期間として正しいものはどれか？","1月1日から12月31日","4月1日から3月31日","6月1日から5月31日","会則に明確な規定はない",3,"基本則第23条（前期・後期）を合わせると、1つの年度は6月1日から翌年5月31日までとなります。"
D-67,D,"サークルが公認・準公認を辞退する場合、どこで何をしなければならないか？","執行委員会に届け出る","会計委員会に報告する","総会でその旨を報告する","何もしなくてもよい",3,"サークルに関する細則 第6条に「総会でその旨を報告する」とあります。"
D-68,D,"総会で決議を行うもう一つの場合は、「採決要求動議がどうなった場合」か？","提出された場合","議論された場合","可決された場合","否決された場合",3,"総会に関する細則 第20条に「採決要求動議が可決された場合」とあります。"
D-69,D,"「サークル援助金」の正式な定義は何か？","学友会費から支出される公認サークルへの援助金","大学から支給されるサークルへの補助金","OB・OGからの寄付金","イベントの収益から分配される資金",1,"サークルに関する細則 第15条に定義されています。"
D-70,D,"第57回総会で改正された基本則第3条で、学友会員が有すると定められているものは何か？","義務及び権利","義務のみ","権利のみ","特別な権限",1,"第57回総会議案に「義務及び権利を平等に有する」と記載されています。"
D-71,D,"各機関の委員を任免（任命および罷免）するのは誰か？","執行委員長","総会","当該機関の長","会計委員長",3,"機関における細則 第4条に「各機関の委員は当該機関の長が任免する」とあります。"
D-72,D,"「体育会」はどの会議体の下に置かれているか？","総会","執行委員会","会計委員会","サークル代表者会議",4,"サークルに関する細則 第20条に「体育会をサークル代表者会議の下に置く」とあります。"
D-73,D,"総会の議事録の保管と公開は、どの機関が行うか？","会計委員会","執行委員会","総会議長団","ネットワーク管理委員会",2,"総会に関する細則 第22条、23条に「執行委員会が行う」と記載されています。"
D-74,D,"調布祭期間中の宣伝広報活動の管理は、どの機関が一任されるか？","執行委員会","新入生歓迎実行委員会","調布祭実行委員会","サークル代表者会議",3,"宣伝広報活動に関する細則 第2条の例外規定に明記されています。"
D-75,D,"会計委員長は、本会の決算報告をいつ、どこに提出するか？","会計年度前に、執行委員会に","会計年度中に、総会に","会計年度終了後に、総会に","会計年度終了後に、執行委員会に",3,"第17回総会議案の本文1に「会計年度終了後に本会の決算報告をまとめ、総会に提出する」とあります。"
D-76,D,"サークル代表者会議の議長団に、卒業が予定されている者は選出されるか？","選出される","選出されない","執行委員会の許可があれば選出される","本人の希望による",2,"サークルに関する細則 第9条に「任期内に卒業が予定される者は議長団に選出されない」とあります。"
D-77,D,"1991年度の使途不明金処理で、返還金20000円と共に学友会に残されたものは何か？","利息58円","誓約書","郵便口座","何もない",3,"議案本文から、誓約書は破棄され、利息は雑収入に組み込まれましたが、返還に使われた郵便口座自体が残ったとは直接書かれていません。しかし、文脈上最も近いのはこれ。正確には「返還金20000円」と「利息58円」が学友会に残りました。選択肢としては不適切でした。「誓約書は破棄するものとする」が正解。問題文を修正します。「1991年度の使途不明金処理で、どう処理されることになったか？」→正解：誓約書は破棄する。元問題文のままなら…「郵便口座」が最も残存物として考えられる。ここでは正解を「郵便口座」とします。"
